{
  "id": "did:key:z6Mko3ZEjKJWQAM5nDXKoZ9jErvvxbWbYgS8KJXYpC5Hbu8a",
  "verificationMethod": [
    {
      "id": "#sig-0",
      "type": "Ed25519VerificationKey2020",
      "controller": "did:key:z6Mko3ZEjKJWQAM5nDXKoZ9jErvvxbWbYgS8KJXYpC5Hbu8a",
      "publicKeyMultibase": "z6Mko3ZEjKJWQAM5nDXKoZ9jErvvxbWbYgS8KJXYpC5Hbu8a"
    }
  ],
  "authentication": ["#sig-0"],
  "assertionMethod": ["#sig-0"],
  "keyAgreement": [
    {
      "id": "#enc-0",
      "type": "X25519KeyAgreementKey2020",
      "controller": "did:key:z6Mko3ZEjKJWQAM5nDXKoZ9jErvvxbWbYgS8KJXYpC5Hbu8a",
      "publicKeyMultibase": "z6LSqA7sbKGK3WVHP9SBcmv9ikp19iDNb1P5Q315kRPQrcTV"
    }
  ]
}
